{
  "schema_version": "omnia.disagreement.v1",
  "id": "disagree-dns-resolvers-001",
  "version": "1.0.0",
  "layer": "normative",
  "decision_class": "dns_explicit_resolvers",
  "disagreement_policy": {
    "disagreement_allowed": true,
    "must_publish_conflicting_premises": true,
    "must_publish_evidence_interpretation": true
  },
  "resolution_evidence": {
    "locate_differing_premise_refs": [
      "prem-ref-participant-a-assumes-dhcp-off",
      "prem-ref-participant-b-assumes-dhcp-on"
    ],
    "locate_differing_evidence_interpretation_refs": [
      "interp-ref-a-resolver-lines-from-file-only",
      "interp-ref-b-resolver-lines-includes-runtime-overrides"
    ],
    "identify_discriminating_observation_ids": [
      "obs-dns-dhcp-options-present",
      "obs-dns-resolver-runtime-effective"
    ],
    "perform_bounded_measurement_if_authorized": [
      "bounded-measurement-dhcp-options-read-only",
      "bounded-measurement-effective-resolvers-passive-probe"
    ]
  },
  "fail_closed": true,
  "action_under_unresolved": "LAST_KNOWN_GOOD_RESTORE_ONLY",
  "convergence_criteria": {
    "sufficient_convergence_type": "all_required_observations_materialized",
    "required_evidence_tier": "validated_mock",
    "participant_claims_must_share_evidence_refs": true,
    "must_recompute_after_measurement": true
  },
  "majority_vote_alone_must_not_override": true,
  "recompute_workflow": [
    "locate_differing_premise",
    "locate_differing_evidence_interpretation",
    "identify_discriminating_observation",
    "perform_bounded_measurement_if_authorized",
    "recompute_result_from_omnia_rules"
  ],
  "owner_intent_refs": ["owner-intent-example-001"],
  "invariant_refs": ["inv-example-001"],
  "explanatory_notes": "Minimal valid disagreement resolution fixture with explicit convergence steps and fail-closed behavior; no implicit majority vote override."
}
